15:25:04.334028 enp109s0 In  IP 54.236.169.179.80 > 10.244.1.3.37828: Flags [.], ack 1334313496, win 105, options [nop,nop,TS val 209703425 ecr 2277750238], length 0
15:25:04.446013 enp109s0 In  IP 54.236.169.179.80 > 10.244.1.3.37828: Flags [P.], seq 0:255, ack 1, win 105, options [nop,nop,TS val 209703557 ecr 2277750238], length 255: HTTP: HTTP/1.1 200 OK
15:25:04.446044 enp109s0 Out IP 10.244.1.3.37828 > 54.236.169.179.80: Flags [.], ack 255, win 506, options [nop,nop,TS val 2277750639 ecr 209703557], length 0
15:25:04.446509 enp109s0 Out IP 10.244.1.3.37828 > 54.236.169.179.80: Flags [F.], seq 1, ack 255, win 506, options [nop,nop,TS val 2277750640 ecr 209703557], length 0
15:25:04.450198 enp109s0 Out IP 10.244.1.3.43993 > 10.96.0.10.53: 52824+ A? kubernetes.default.svc.cluster.local.default.svc.cluster.local. (80)
15:25:04.450387 enp109s0 Out IP 10.244.1.3.43993 > 10.96.0.10.53: 64833+ AAAA? kubernetes.default.svc.cluster.local.default.svc.cluster.local. (80)
15:25:04.450824 enp109s0 In  IP 10.96.0.10.53 > 10.244.1.3.43993: 64833 NXDomain*- 0/1/0 (173)
15:25:04.450948 enp109s0 In  IP 10.96.0.10.53 > 10.244.1.3.43993: 52824 NXDomain*- 0/1/0 (173)
15:25:04.451047 enp109s0 Out IP 10.244.1.3.59137 > 10.96.0.10.53: 42839+ A? kubernetes.default.svc.cluster.local.svc.cluster.local. (72)
15:25:04.451097 enp109s0 Out IP 10.244.1.3.59137 > 10.96.0.10.53: 1113+ AAAA? kubernetes.default.svc.cluster.local.svc.cluster.local. (72)
15:25:04.451890 enp109s0 In  IP 10.96.0.10.53 > 10.244.1.3.59137: 1113 NXDomain*- 0/1/0 (165)
15:25:04.451983 enp109s0 In  IP 10.96.0.10.53 > 10.244.1.3.59137: 42839 NXDomain*- 0/1/0 (165)
15:25:04.452050 enp109s0 Out IP 10.244.1.3.40982 > 10.96.0.10.53: 53713+ A? kubernetes.default.svc.cluster.local.cluster.local. (68)
15:25:04.452179 enp109s0 Out IP 10.244.1.3.40982 > 10.96.0.10.53: 38101+ AAAA? kubernetes.default.svc.cluster.local.cluster.local. (68)
15:25:04.452491 enp109s0 In  IP 10.96.0.10.53 > 10.244.1.3.40982: 38101 NXDomain*- 0/1/0 (161)
15:25:04.452579 enp109s0 In  IP 10.96.0.10.53 > 10.244.1.3.40982: 53713 NXDomain*- 0/1/0 (161)
15:25:04.452639 enp109s0 Out IP 10.244.1.3.59659 > 10.96.0.10.53: 61388+ A? kubernetes.default.svc.cluster.local.hgu_lan. (62)
15:25:04.452708 enp109s0 Out IP 10.244.1.3.59659 > 10.96.0.10.53: 34497+ AAAA? kubernetes.default.svc.cluster.local.hgu_lan. (62)
15:25:04.467184 enp109s0 In  IP 54.236.169.179.80 > 10.244.1.3.37828: Flags [F.], seq 255, ack 1, win 105, options [nop,nop,TS val 209703557 ecr 2277750238], length 0
15:25:04.467196 enp109s0 Out IP 10.244.1.3.37828 > 54.236.169.179.80: Flags [.], ack 256, win 506, options [nop,nop,TS val 2277750661 ecr 209703557], length 0
15:25:04.467774 enp109s0 In  IP 10.96.0.10.53 > 10.244.1.3.59659: 34497 NXDomain 0/1/0 (137)
15:25:04.467887 enp109s0 In  IP 10.96.0.10.53 > 10.244.1.3.59659: 61388 NXDomain 0/1/0 (137)
15:25:04.467951 enp109s0 Out IP 10.244.1.3.38531 > 10.96.0.10.53: 22366+ A? kubernetes.default.svc.cluster.local. (54)
15:25:04.468041 enp109s0 Out IP 10.244.1.3.38531 > 10.96.0.10.53: 17954+ AAAA? kubernetes.default.svc.cluster.local. (54)
15:25:04.468278 enp109s0 In  IP 10.96.0.10.53 > 10.244.1.3.38531: 17954*- 0/1/0 (147)
15:25:04.468319 enp109s0 In  IP 10.96.0.10.53 > 10.244.1.3.38531: 22366*- 1/0/0 A 10.96.0.1 (106)
15:25:04.468408 enp109s0 Out IP 10.244.1.3 > 10.96.0.1: ICMP echo request, id 19, seq 0, length 64
15:25:04.739909 enp109s0 In  IP 54.236.169.179.80 > 10.244.1.3.37828: Flags [.], ack 2, win 105, options [nop,nop,TS val 209703830 ecr 2277750640], length 0
15:25:05.468494 enp109s0 Out IP 10.244.1.3 > 10.96.0.1: ICMP echo request, id 19, seq 1, length 64
15:25:06.468645 enp109s0 Out IP 10.244.1.3 > 10.96.0.1: ICMP echo request, id 19, seq 2, length 64
15:25:08.747481 enp109s0 In  ARP, Request who-has 10.244.1.3 tell 10.244.1.1, length 28
15:25:08.747497 enp109s0 Out ARP, Reply 10.244.1.3 is-at 12:35:93:c4:42:9e, length 28
15:25:09.260272 enp109s0 Out IP6 fe80::1035:93ff:fec4:429e > ff02::2: ICMP6, router solicitation, length 16
15:25:16.471853 enp109s0 Out IP 10.244.1.3.48194 > 10.96.0.10.53: 21186+ A? kubernetes.default.svc.cluster.local.default.svc.cluster.local. (80)
15:25:16.471914 enp109s0 Out IP 10.244.1.3.48194 > 10.96.0.10.53: 1787+ AAAA? kubernetes.default.svc.cluster.local.default.svc.cluster.local. (80)
15:25:16.474654 enp109s0 In  IP 10.96.0.10.53 > 10.244.1.3.48194: 1787 NXDomain*- 0/1/0 (173)
15:25:16.474675 enp109s0 In  IP 10.96.0.10.53 > 10.244.1.3.48194: 21186 NXDomain*- 0/1/0 (173)
15:25:16.474828 enp109s0 Out IP 10.244.1.3.50026 > 10.96.0.10.53: 58910+ A? kubernetes.default.svc.cluster.local.svc.cluster.local. (72)
15:25:16.474877 enp109s0 Out IP 10.244.1.3.50026 > 10.96.0.10.53: 53272+ AAAA? kubernetes.default.svc.cluster.local.svc.cluster.local. (72)
15:25:16.475497 enp109s0 In  IP 10.96.0.10.53 > 10.244.1.3.50026: 58910 NXDomain*- 0/1/0 (165)
15:25:16.475831 enp109s0 In  IP 10.96.0.10.53 > 10.244.1.3.50026: 53272 NXDomain*- 0/1/0 (165)
15:25:16.475979 enp109s0 Out IP 10.244.1.3.38298 > 10.96.0.10.53: 12154+ A? kubernetes.default.svc.cluster.local.cluster.local. (68)
15:25:16.476016 enp109s0 Out IP 10.244.1.3.38298 > 10.96.0.10.53: 41846+ AAAA? kubernetes.default.svc.cluster.local.cluster.local. (68)
15:25:16.477541 enp109s0 In  IP 10.96.0.10.53 > 10.244.1.3.38298: 12154 NXDomain*- 0/1/0 (161)
15:25:16.477572 enp109s0 In  IP 10.96.0.10.53 > 10.244.1.3.38298: 41846 NXDomain*- 0/1/0 (161)
15:25:16.477665 enp109s0 Out IP 10.244.1.3.48927 > 10.96.0.10.53: 21393+ A? kubernetes.default.svc.cluster.local.hgu_lan. (62)
15:25:16.477702 enp109s0 Out IP 10.244.1.3.48927 > 10.96.0.10.53: 7071+ AAAA? kubernetes.default.svc.cluster.local.hgu_lan. (62)
15:25:16.478221 enp109s0 In  IP 10.96.0.10.53 > 10.244.1.3.48927: 7071 NXDomain* 0/1/0 (137)
15:25:16.478279 enp109s0 In  IP 10.96.0.10.53 > 10.244.1.3.48927: 21393 NXDomain* 0/1/0 (137)
15:25:16.478322 enp109s0 Out IP 10.244.1.3.34802 > 10.96.0.10.53: 32957+ A? kubernetes.default.svc.cluster.local. (54)
